{
  "contract": "statistics.v1",
  "summaries": [
    {
      "values": [
        1,
        2,
        3
      ],
      "convention": "population",
      "trace": {
        "contract": "statistics.v1",
        "count": 3,
        "convention": "population",
        "denominator": 3,
        "mean": 2.0,
        "median": 2,
        "modes": [],
        "minimum": 1,
        "maximum": 3,
        "range": 2,
        "variance": 0.6666666666666666,
        "standardDeviation": 0.816496580927726,
        "q1": 1,
        "q3": 3,
        "iqr": 2,
        "lowerFence": -2.0,
        "upperFence": 6.0,
        "whiskerLow": 1,
        "whiskerHigh": 3,
        "outliers": []
      }
    },
    {
      "values": [
        1,
        2,
        3
      ],
      "convention": "sample",
      "trace": {
        "contract": "statistics.v1",
        "count": 3,
        "convention": "sample",
        "denominator": 2,
        "mean": 2.0,
        "median": 2,
        "modes": [],
        "minimum": 1,
        "maximum": 3,
        "range": 2,
        "variance": 1.0,
        "standardDeviation": 1.0,
        "q1": 1,
        "q3": 3,
        "iqr": 2,
        "lowerFence": -2.0,
        "upperFence": 6.0,
        "whiskerLow": 1,
        "whiskerHigh": 3,
        "outliers": []
      }
    },
    {
      "values": [
        1,
        1,
        2,
        2,
        3
      ],
      "convention": "population",
      "trace": {
        "contract": "statistics.v1",
        "count": 5,
        "convention": "population",
        "denominator": 5,
        "mean": 1.8,
        "median": 2,
        "modes": [
          1,
          2
        ],
        "minimum": 1,
        "maximum": 3,
        "range": 2,
        "variance": 0.56,
        "standardDeviation": 0.7483314773547883,
        "q1": 1.0,
        "q3": 2.5,
        "iqr": 1.5,
        "lowerFence": -1.25,
        "upperFence": 4.75,
        "whiskerLow": 1,
        "whiskerHigh": 3,
        "outliers": []
      }
    },
    {
      "values": [
        1,
        2,
        3,
        4,
        5
      ],
      "convention": "sample",
      "trace": {
        "contract": "statistics.v1",
        "count": 5,
        "convention": "sample",
        "denominator": 4,
        "mean": 3.0,
        "median": 3,
        "modes": [],
        "minimum": 1,
        "maximum": 5,
        "range": 4,
        "variance": 2.5,
        "standardDeviation": 1.5811388300841898,
        "q1": 1.5,
        "q3": 4.5,
        "iqr": 3.0,
        "lowerFence": -3.0,
        "upperFence": 9.0,
        "whiskerLow": 1,
        "whiskerHigh": 5,
        "outliers": []
      }
    },
    {
      "values": [
        1,
        2,
        3,
        4,
        5,
        6,
        7,
        100
      ],
      "convention": "population",
      "trace": {
        "contract": "statistics.v1",
        "count": 8,
        "convention": "population",
        "denominator": 8,
        "mean": 16.0,
        "median": 4.5,
        "modes": [],
        "minimum": 1,
        "maximum": 100,
        "range": 99,
        "variance": 1011.5,
        "standardDeviation": 31.804087787578503,
        "q1": 2.5,
        "q3": 6.5,
        "iqr": 4.0,
        "lowerFence": -3.5,
        "upperFence": 12.5,
        "whiskerLow": 1,
        "whiskerHigh": 7,
        "outliers": [
          100
        ]
      }
    },
    {
      "values": [
        5,
        5,
        5
      ],
      "convention": "population",
      "trace": {
        "contract": "statistics.v1",
        "count": 3,
        "convention": "population",
        "denominator": 3,
        "mean": 5.0,
        "median": 5,
        "modes": [
          5
        ],
        "minimum": 5,
        "maximum": 5,
        "range": 0,
        "variance": 0.0,
        "standardDeviation": 0.0,
        "q1": 5,
        "q3": 5,
        "iqr": 0,
        "lowerFence": 5.0,
        "upperFence": 5.0,
        "whiskerLow": 5,
        "whiskerHigh": 5,
        "outliers": []
      }
    },
    {
      "values": [
        5
      ],
      "convention": "population",
      "trace": {
        "contract": "statistics.v1",
        "count": 1,
        "convention": "population",
        "denominator": 1,
        "mean": 5.0,
        "median": 5,
        "modes": [],
        "minimum": 5,
        "maximum": 5,
        "range": 0,
        "variance": 0.0,
        "standardDeviation": 0.0,
        "q1": 5,
        "q3": 5,
        "iqr": 0,
        "lowerFence": 5.0,
        "upperFence": 5.0,
        "whiskerLow": 5,
        "whiskerHigh": 5,
        "outliers": []
      }
    },
    {
      "values": [
        4,
        5,
        5,
        6
      ],
      "convention": "population",
      "trace": {
        "contract": "statistics.v1",
        "count": 4,
        "convention": "population",
        "denominator": 4,
        "mean": 5.0,
        "median": 5.0,
        "modes": [
          5
        ],
        "minimum": 4,
        "maximum": 6,
        "range": 2,
        "variance": 0.5,
        "standardDeviation": 0.7071067811865476,
        "q1": 4.5,
        "q3": 5.5,
        "iqr": 1.0,
        "lowerFence": 3.0,
        "upperFence": 7.0,
        "whiskerLow": 4,
        "whiskerHigh": 6,
        "outliers": []
      }
    },
    {
      "values": [
        0,
        0,
        10,
        10
      ],
      "convention": "population",
      "trace": {
        "contract": "statistics.v1",
        "count": 4,
        "convention": "population",
        "denominator": 4,
        "mean": 5.0,
        "median": 5.0,
        "modes": [
          0,
          10
        ],
        "minimum": 0,
        "maximum": 10,
        "range": 10,
        "variance": 25.0,
        "standardDeviation": 5.0,
        "q1": 0.0,
        "q3": 10.0,
        "iqr": 10.0,
        "lowerFence": -15.0,
        "upperFence": 25.0,
        "whiskerLow": 0,
        "whiskerHigh": 10,
        "outliers": []
      }
    }
  ],
  "paired": [
    {
      "x": [
        1,
        2,
        3
      ],
      "y": [
        2,
        4,
        6
      ],
      "convention": "sample",
      "trace": {
        "contract": "statistics.v1",
        "count": 3,
        "convention": "sample",
        "covariance": 2.0,
        "correlation": 1
      }
    },
    {
      "x": [
        1,
        2,
        3
      ],
      "y": [
        2,
        4,
        6
      ],
      "convention": "population",
      "trace": {
        "contract": "statistics.v1",
        "count": 3,
        "convention": "population",
        "covariance": 1.3333333333333333,
        "correlation": 1
      }
    },
    {
      "x": [
        1,
        2,
        3
      ],
      "y": [
        6,
        4,
        2
      ],
      "convention": "sample",
      "trace": {
        "contract": "statistics.v1",
        "count": 3,
        "convention": "sample",
        "covariance": -2.0,
        "correlation": -1
      }
    },
    {
      "x": [
        1,
        1,
        1
      ],
      "y": [
        1,
        2,
        3
      ],
      "convention": "sample",
      "trace": {
        "contract": "statistics.v1",
        "count": 3,
        "convention": "sample",
        "covariance": 0.0,
        "correlation": null
      }
    },
    {
      "x": [
        -2,
        -1,
        0,
        1,
        2
      ],
      "y": [
        4,
        1,
        0,
        1,
        4
      ],
      "convention": "sample",
      "trace": {
        "contract": "statistics.v1",
        "count": 5,
        "convention": "sample",
        "covariance": 0.0,
        "correlation": 0.0
      }
    }
  ],
  "histograms": [
    {
      "values": [
        1,
        2,
        3,
        4
      ],
      "bins": 2,
      "trace": {
        "contract": "statistics.v1",
        "bins": [
          {
            "lower": 1.0,
            "upper": 2.5,
            "includesUpper": false,
            "count": 2
          },
          {
            "lower": 2.5,
            "upper": 4.0,
            "includesUpper": true,
            "count": 2
          }
        ]
      }
    },
    {
      "values": [
        0,
        1,
        2
      ],
      "bins": 2,
      "trace": {
        "contract": "statistics.v1",
        "bins": [
          {
            "lower": 0.0,
            "upper": 1.0,
            "includesUpper": false,
            "count": 1
          },
          {
            "lower": 1.0,
            "upper": 2.0,
            "includesUpper": true,
            "count": 2
          }
        ]
      }
    },
    {
      "values": [
        5,
        5,
        5
      ],
      "bins": 4,
      "trace": {
        "contract": "statistics.v1",
        "bins": [
          {
            "lower": 5,
            "upper": 6,
            "includesUpper": false,
            "count": 3
          },
          {
            "lower": 6,
            "upper": 7,
            "includesUpper": false,
            "count": 0
          },
          {
            "lower": 7,
            "upper": 8,
            "includesUpper": false,
            "count": 0
          },
          {
            "lower": 8,
            "upper": 9,
            "includesUpper": true,
            "count": 0
          }
        ]
      }
    }
  ],
  "sampling": [
    {
      "size": 2,
      "repetitions": 5,
      "seed": 42,
      "biased": false,
      "trace": {
        "contract": "statistics.v1",
        "population": [
          0,
          0,
          0,
          0,
          0,
          0,
          0,
          0,
          10,
          10
        ],
        "populationMean": 2.0,
        "populationDeviation": 4.0,
        "sampleSize": 2,
        "repetitions": 5,
        "seed": 42,
        "biased": false,
        "standardError": 2.82842712474619,
        "samples": [
          {
            "mean": 0.0,
            "lower": -5.543717164502532,
            "upper": 5.543717164502532,
            "covers": true
          },